{"duration_ms":8.25,"event_id":"0191f0b9-1c2f-7a3d-8e4f-0a1b2c3d4e5f","kind":"rpc","level":"info","operation":"grpc.health.v1.Health/Check","outcome":"success","rpc":{"method":"Check","peer":"bufconn","service":"grpc.health.v1.Health","status_code":"OK","system":"grpc"},"summary":"grpc grpc.health.v1.Health/Check OK in {d}","timestamp":"2026-01-01T00:00:00Z","trace":{},"wlog":{"schema_version":2}}
