{"duration_ms":8.25,"event_id":"0191f0b9-1c2f-7a3d-8e4f-0a1b2c3d4e5f","http":{"bytes_in":24,"bytes_out":0,"client_ip":"192.0.2.1","host":"example.com","method":"POST","path":"/orders/42","protocol":"HTTP/1.1","request_body":[{"password":"[REDACTED]"}],"request_headers":{"content-type":"application/json","x-request-id":"conformance-1"},"response_headers":{"x-request-id":"conformance-1"},"route":"/orders/{id}","scheme":"http","status":201,"user_agent":""},"kind":"request","level":"info","operation":"POST /orders/{id}","outcome":"success","summary":"POST /orders/{id} 201 in {d}","timestamp":"2026-01-01T00:00:00Z","trace":{"request_id":"conformance-1"},"wlog":{"schema_version":2}}