{"duration_ms":8.25,"error":{"caller":"exchange.go:108","code":"INTERNAL","message":"panic: conformance panic","stack":"goroutine 20 [running]:","type":"*httpcore.panicError"},"event_id":"0191f0b9-1c2f-7a3d-8e4f-0a1b2c3d4e5f","http":{"bytes_in":0,"bytes_out":0,"client_ip":"192.0.2.1","host":"example.com","method":"GET","path":"/panic","protocol":"HTTP/1.1","route":"/panic","scheme":"http","status":500,"user_agent":""},"kind":"request","level":"error","operation":"GET /panic","outcome":"error","summary":"GET /panic 500 in {d}: INTERNAL panic: conformance panic","timestamp":"2026-01-01T00:00:00Z","trace":{"request_id":"conformance-1"},"wlog":{"schema_version":2}}
