{"timestamp":"2026-01-01T00:00:00Z","level":"info","operation":"process orders.created","kind":"message","outcome":"success","duration_ms":2.125,"event_id":"0191f0b9-1c2f-7a3d-8e4f-0a1b2c3d4e5f","trace":{"trace_id":"4bf92f3577b34da6a3ce929d0e0e4736","span_id":"00f067aa0ba902b7"},"messaging":{"system":"kafka","operation":"process","destination":"orders"},"wlog":{"schema_version":2}}
