{"timestamp":"2026-01-01T00:00:00Z","level":"info","summary":"chat gpt-4o success in 1.2s","operation":"chat","kind":"work","outcome":"success","duration_ms":1200.5,"event_id":"0191f0b9-1c2f-7a3d-8e4f-0a1b2c3d4e5f","llm":{"provider":"openai","operation":"chat","request_model":"gpt-4o","response_model":"gpt-4o-2024-08-06","response_id":"chatcmpl-1","finish_reasons":["stop"],"input_tokens":120,"output_tokens":48,"cache_read_input_tokens":10,"cache_write_input_tokens":5,"reasoning_tokens":7},"wlog":{"schema_version":2}}
