{"duration_ms":8.25,"error":{"caller":"exchange.go:209","code":"INTERNAL","message":"conformance failure","type":"*errors.errorString"},"event_id":"0191f0b9-1c2f-7a3d-8e4f-0a1b2c3d4e5f","http":{"bytes_in":0,"bytes_out":0,"client_ip":"192.0.2.1","host":"example.com","method":"GET","path":"/fail","protocol":"HTTP/1.1","route":"/fail","scheme":"http","status":502,"user_agent":""},"kind":"request","level":"error","operation":"GET /fail","outcome":"error","summary":"GET /fail 502 in {d}: INTERNAL conformance failure","timestamp":"2026-01-01T00:00:00Z","trace":{"request_id":"conformance-1"},"wlog":{"schema_version":2}}
