{"duration_ms":8.25,"event_id":"0191f0b9-1c2f-7a3d-8e4f-0a1b2c3d4e5f","kind":"rpc","level":"info","operation":"weather-mcp/tools/call","outcome":"success","rpc":{"mcp":{"client":"weather-cli/2.0.0","protocol_version":"2026-07-28","result":"ok","tool":"get_weather"},"method":"tools/call","service":"weather-mcp","system":"mcp"},"summary":"mcp weather-mcp/tools/call in {d}","timestamp":"2026-01-01T00:00:00Z","trace":{},"wlog":{"schema_version":2}}
