{"duration_ms":8.25,"event_id":"0191f0b9-1c2f-7a3d-8e4f-0a1b2c3d4e5f","http":{"bytes_in":0,"bytes_out":5,"client_ip":"192.0.2.1","host":"example.com","method":"GET","path":"/stream","protocol":"HTTP/1.1","response_headers":{"content-type":"text/plain"},"route":"/stream","scheme":"http","status":200,"user_agent":""},"kind":"request","level":"info","operation":"GET /stream","outcome":"success","summary":"GET /stream 200 in {d}","timestamp":"2026-01-01T00:00:00Z","trace":{"request_id":"conformance-1"},"wlog":{"schema_version":2}}
