{
  "duration_ms": 8.25,
  "event_id": "0191f0b9-1c2f-7a3d-8e4f-0a1b2c3d4e5f",
  "kind": "work",
  "level": "info",
  "call_stats": {
    "llm": {
      "count": 1
    }
  },
  "calls": [
    {
      "kind": "llm",
      "operation": "chat",
      "system": "anthropic"
    }
  ],
  "llm": {
    "calls": [
      {
        "cost_micros": 6000,
        "finish_reasons": [
          "end_turn"
        ],
        "input_tokens": 1000,
        "operation": "chat",
        "output_tokens": 200,
        "provider": "anthropic",
        "request_model": "claude-sonnet-4-6",
        "response_id": "msg_01ABC123",
        "total_tokens": 1200
      }
    ],
    "cost_micros": 6000,
    "finish_reasons": [
      "end_turn"
    ],
    "input_tokens": 1000,
    "operation": "chat",
    "output_tokens": 200,
    "provider": "anthropic",
    "request_model": "claude-sonnet-4-6",
    "response_id": "msg_01ABC123",
    "tool_call_count": 0,
    "total_tokens": 1200
  },
  "operation": "answer question",
  "outcome": "success",
  "summary": "answer question success in {d}",
  "timestamp": "2026-01-01T00:00:00Z",
  "trace": {},
  "wlog": {
    "schema_version": 2
  }
}
